configuration.json

{"discountRates":{"SENIOR_CITIZEN":0.30,"STUDENT":0.25,"ADULT":0.22,"CHILD":0.50},"dailyCaps":{"SENIOR_CITIZEN":7.00,"STUDENT":6.00,"ADULT":8.00,"CHILD":4.00},"baseFares":{"4-4-PEAK":2.00,"5-4-PEAK":2.90,"2-5-OFF_PEAK":3.80,"5-5-OFF_PEAK":1.50,"3-3-OFF_PEAK":1.70,"4-1-OFF_PEAK":3.70,"1-1-OFF_PEAK":2.00,"2-2-OFF_PEAK":1.90,"1-4-OFF_PEAK":3.70,"1-4-PEAK":4.40,"3-4-PEAK":3.00,"2-4-PEAK":3.80,"2-1-OFF_PEAK":2.70,"5-5-PEAK":1.90,"5-3-OFF_PEAK":3.10,"2-3-PEAK":3.10,"4-3-PEAK":3.00,"4-2-OFF_PEAK":3.20,"1-5-PEAK":5.00,"3-2-PEAK":3.10,"3-1-OFF_PEAK":3.20,"1-2-PEAK":3.20,"3-5-PEAK":3.70,"1-5-OFF_PEAK":4.20,"5-2-PEAK":4.50,"5-2-OFF_PEAK":3.80,"5-1-PEAK":5.00,"3-1-PEAK":3.80,"4-1-PEAK":4.40,"2-1-PEAK":3.20,"5-4-OFF_PEAK":2.40,"4-3-OFF_PEAK":2.50,"3-5-OFF_PEAK":3.10,"5-1-OFF_PEAK":4.20,"1-1-PEAK":2.50,"2-4-OFF_PEAK":3.20,"3-2-OFF_PEAK":2.60,"1-3-OFF_PEAK":3.20,"3-3-PEAK":2.10,"4-5-OFF_PEAK":2.40,"3-4-OFF_PEAK":2.50,"5-3-PEAK":3.70,"1-3-PEAK":3.80,"2-2-PEAK":2.30,"2-5-PEAK":4.50,"4-2-PEAK":3.80,"4-5-PEAK":2.90,"2-3-OFF_PEAK":2.60,"1-2-OFF_PEAK":2.70,"4-4-OFF_PEAK":1.60}}

IY4113 Part 2 Milestone 2.md

# CityRidedataset.java:

// Peak fares  
put(m,1,1,TimeBand.PEAK,"2.50"); put(m,1,2,TimeBand.PEAK,"3.20");  
put(m,1,3,TimeBand.PEAK,"3.80"); put(m,1,4,TimeBand.PEAK,"4.40");  
put(m,1,5,TimeBand.PEAK,"5.00");

put(m,2,1,TimeBand.PEAK,"3.20"); put(m,2,2,TimeBand.PEAK,"2.30");  
put(m,2,3,TimeBand.PEAK,"3.10"); put(m,2,4,TimeBand.PEAK,"3.80");  
put(m,2,5,TimeBand.PEAK,"4.50");

put(m,3,1,TimeBand.PEAK,"3.80"); put(m,3,2,TimeBand.PEAK,"3.10");  
put(m,3,3,TimeBand.PEAK,"2.10"); put(m,3,4,TimeBand.PEAK,"3.00");  
put(m,3,5,TimeBand.PEAK,"3.70");

put(m,4,1,TimeBand.PEAK,"4.40"); put(m,4,2,TimeBand.PEAK,"3.80");  
put(m,4,3,TimeBand.PEAK,"3.00"); put(m,4,4,TimeBand.PEAK,"2.00");  
put(m,4,5,TimeBand.PEAK,"2.90");

put(m,5,1,TimeBand.PEAK,"5.00"); put(m,5,2,TimeBand.PEAK,"4.50");  
put(m,5,3,TimeBand.PEAK,"3.70"); put(m,5,4,TimeBand.PEAK,"2.90");  
put(m,5,5,TimeBand.PEAK,"1.90");

// Off-peak fares  
put(m,1,1,TimeBand.OFF_PEAK,"2.00"); put(m,1,2,TimeBand.OFF_PEAK,"2.70");  
put(m,1,3,TimeBand.OFF_PEAK,"3.20"); put(m,1,4,TimeBand.OFF_PEAK,"3.70");  
put(m,1,5,TimeBand.OFF_PEAK,"4.20");

put(m,2,1,TimeBand.OFF_PEAK,"2.70"); put(m,2,2,TimeBand.OFF_PEAK,"1.90");  
put(m,2,3,TimeBand.OFF_PEAK,"2.60"); put(m,2,4,TimeBand.OFF_PEAK,"3.20");  
put(m,2,5,TimeBand.OFF_PEAK,"3.80");

put(m,3,1,TimeBand.OFF_PEAK,"3.20"); put(m,3,2,TimeBand.OFF_PEAK,"2.60");  
put(m,3,3,TimeBand.OFF_PEAK,"1.70"); put(m,3,4,TimeBand.OFF_PEAK,"2.50");  
put(m,3,5,TimeBand.OFF_PEAK,"3.10");

put(m,4,1,TimeBand.OFF_PEAK,"3.70"); put(m,4,2,TimeBand.OFF_PEAK,"3.20");  
put(m,4,3,TimeBand.OFF_PEAK,"2.50"); put(m,4,4,TimeBand.OFF_PEAK,"1.60");  
put(m,4,5,TimeBand.OFF_PEAK,"2.40");

put(m,5,1,TimeBand.OFF_PEAK,"4.20"); put(m,5,2,TimeBand.OFF_PEAK,"3.80");  
put(m,5,3,TimeBand.OFF_PEAK,"3.10"); put(m,5,4,TimeBand.OFF_PEAK,"2.40");  
put(m,5,5,TimeBand.OFF_PEAK,"1.50");